{
  "schema": "foldbench.pareto.artifact.v1",
  "artifact_version": 1,
  "shard_id": "shard_002",
  "model_id": "Protenix-v1",
  "variant_label": "Protenix-v1",
  "checkpoint_path": "/home/ktretina/.openclaw/workspace/github_projects/FoldBench/checkpoints/protenix_base_default_v1.0.0.pt",
  "checkpoint_sha256": "2b7d5a8b30494514fc47fd2271a16260528cdba170ba09cc112fdecd8f85ec04",
  "af3_input_json": "/home/ktretina/.openclaw/workspace/github_projects/FoldBench/inputs/full_2023plus_shards/alphafold3_inputs_shard_002.json",
  "af3_input_sha256": "d8f9390f48d2b428de4ab8c2df56ea4bd7e7e4c2a29ce82928ba9c7519300101",
  "targets_total": 100,
  "targets_completed": 100,
  "segment_size": 20,
  "segments_total": 5,
  "segments_completed": 5,
  "seeds": [
    "42",
    "66",
    "101",
    "2024",
    "8888"
  ],
  "samples_per_target": 5,
  "expected_samples": 2500,
  "actual_samples": 2500,
  "completion_gate_ok": true,
  "walltime_seconds": 27818.0,
  "throughput_samples_per_min": 5.392192105830757,
  "cost_proxy_gpu_seconds": 27818.0,
  "quality_summary_path": "/home/ktretina/.openclaw/workspace/github_projects/FoldBench/campaigns/strict_full_shard002_monolith_resilient/quality/shard_002_summary.csv",
  "quality_metric_primary": null,
  "quality_metric_secondary": null,
  "quality_notes": "Populate after evaluation/summary stage.",
  "resume_state_json": "/home/ktretina/.openclaw/workspace/github_projects/FoldBench/campaigns/strict_full_shard002_monolith_resilient/resume_state.json",
  "aggregate_pred_root": "/home/ktretina/.openclaw/workspace/github_projects/FoldBench/campaigns/strict_full_shard002_monolith_resilient/aggregate/prediction/Protenix",
  "created_at_utc": "20260222T133753Z"
}